[I 2025-05-14 01:44:03,072] Trial 8 finished with value: 0.16229889063236289 and parameters: {'xgb_learning_rate': 0.16411809099649532, 'xgb_max_depth': 4, 'xgb_n_estimators': 546, 'xgb_subsample': 0.8118667128493264, 'xgb_colsample_bytree': 0.7086728410967384, 'xgb_gamma': 0.29709516043760975, 'xgb_reg_alpha': 3.3135622166464954e-06, 'xgb_reg_lambda': 0.008760830901818664, 'lgbm_learning_rate': 0.194969673268093, 'lgbm_num_leaves': 91, 'lgbm_n_estimators': 728, 'lgbm_max_depth': 6, 'lgbm_subsample': 0.8160321917948669, 'lgbm_colsample_bytree': 0.6527544116929459, 'lgbm_reg_alpha': 0.0027740491065429518, 'lgbm_reg_lambda': 0.004235579365437045, 'rf_n_estimators': 171, 'rf_max_depth': 5, 'rf_min_samples_split': 9, 'rf_min_samples_leaf': 11, 'rf_max_features': 0.7, 'catboost_iterations': 494, 'catboost_learning_rate': 0.07024469413859742, 'catboost_depth': 6, 'catboost_l2_leaf_reg': 4.657001672876109, 'catboost_border_count': 186}. Best is trial 3 with value: 0.16122992083465745.
2025-05-14 01:44:03,446 - INFO - Training rf on fold 1
2025-05-14 01:44:04,739 - INFO - Start training of model rf, at time 2025-05-14 01:44:04.739387
2025-05-14 01:50:04,739 - INFO - End training of model rf, at time 2025-05-14 01:50:04.738313
2025-05-14 01:50:18,482 - INFO - Training rf on fold 2
2025-05-14 01:50:37,358 - INFO - Start training of model rf, at time 2025-05-14 01:50:37.357012
2025-05-14 01:56:34,019 - INFO - End training of model rf, at time 2025-05-14 01:56:34.017693
2025-05-14 01:56:48,469 - INFO - Training rf on fold 3
2025-05-14 01:57:04,003 - INFO - Start training of model rf, at time 2025-05-14 01:57:04.002024
2025-05-14 02:03:00,429 - INFO - End training of model rf, at time 2025-05-14 02:03:00.428505
2025-05-14 02:03:14,966 - INFO - Model: rf, Cross-Validated RMSE: 0.16146417656353937
[I 2025-05-14 02:03:15,141] Trial 9 finished with value: 0.16146417656353937 and parameters: {'xgb_learning_rate': 0.11259904113186875, 'xgb_max_depth': 8, 'xgb_n_estimators': 555, 'xgb_subsample': 0.691242673889638, 'xgb_colsample_bytree': 0.7097490349536976, 'xgb_gamma': 0.4863571201931397, 'xgb_reg_alpha': 6.8371887532896435e-06, 'xgb_reg_lambda': 0.003138648278244386, 'lgbm_learning_rate': 0.012421656059221313, 'lgbm_num_leaves': 68, 'lgbm_n_estimators': 182, 'lgbm_max_depth': 8, 'lgbm_subsample': 0.6859858565680031, 'lgbm_colsample_bytree': 0.7232341593879996, 'lgbm_reg_alpha': 0.051892661735372214, 'lgbm_reg_lambda': 2.3483397651732772e-08, 'rf_n_estimators': 395, 'rf_max_depth': 23, 'rf_min_samples_split': 15, 'rf_min_samples_leaf': 1, 'rf_max_features': 'sqrt', 'catboost_iterations': 401, 'catboost_learning_rate': 0.01741587552289756, 'catboost_depth': 10, 'catboost_l2_leaf_reg': 6.158196897415085, 'catboost_border_count': 220}. Best is trial 3 with value: 0.16122992083465745.
2025-05-14 02:03:16,876 - INFO - Training rf on fold 1
2025-05-14 02:03:30,845 - INFO - Start training of model rf, at time 2025-05-14 02:03:30.845087
2025-05-14 02:20:02,808 - INFO - End training of model rf, at time 2025-05-14 02:20:02.808790
2025-05-14 02:20:08,908 - INFO - Training rf on fold 2
2025-05-14 02:20:13,330 - INFO - Start training of model rf, at time 2025-05-14 02:20:13.327788
2025-05-14 02:36:44,117 - INFO - End training of model rf, at time 2025-05-14 02:36:44.117005
2025-05-14 02:36:50,792 - INFO - Training rf on fold 3
2025-05-14 02:36:57,398 - INFO - Start training of model rf, at time 2025-05-14 02:36:57.396888
2025-05-14 02:53:33,043 - INFO - End training of model rf, at time 2025-05-14 02:53:33.043177
2025-05-14 02:53:38,564 - INFO - Model: rf, Cross-Validated RMSE: 0.16145318000591502
[I 2025-05-14 02:53:38,658] Trial 10 finished with value: 0.16145318000591502 and parameters: {'xgb_learning_rate': 0.011046115203959915, 'xgb_max_depth': 6, 'xgb_n_estimators': 701, 'xgb_subsample': 0.6015043461628807, 'xgb_colsample_bytree': 0.6241358187063352, 'xgb_gamma': 0.04012477849332258, 'xgb_reg_alpha': 0.002045956293644282, 'xgb_reg_lambda': 1.9503607911091433e-06, 'lgbm_learning_rate': 0.09112560633912613, 'lgbm_num_leaves': 191, 'lgbm_n_estimators': 114, 'lgbm_max_depth': 9, 'lgbm_subsample': 0.8788852064559398, 'lgbm_colsample_bytree': 0.9996591069553377, 'lgbm_reg_alpha': 4.6387416536339495e-06, 'lgbm_reg_lambda': 0.0003940465549819407, 'rf_n_estimators': 497, 'rf_max_depth': 11, 'rf_min_samples_split': 20, 'rf_min_samples_leaf': 15, 'rf_max_features': 0.7, 'catboost_iterations': 201, 'catboost_learning_rate': 0.1761216356149371, 'catboost_depth': 8, 'catboost_l2_leaf_reg': 1.0743634154673638, 'catboost_border_count': 101}. Best is trial 3 with value: 0.16122992083465745.
2025-05-14 02:53:39,730 - INFO - Training rf on fold 1
2025-05-14 02:53:43,254 - INFO - Start training of model rf, at time 2025-05-14 02:53:43.254003
2025-05-14 03:10:14,426 - INFO - End training of model rf, at time 2025-05-14 03:10:14.424995
2025-05-14 03:10:22,354 - INFO - Training rf on fold 2
2025-05-14 03:10:32,374 - INFO - Start training of model rf, at time 2025-05-14 03:10:32.373109
2025-05-14 03:27:11,095 - INFO - End training of model rf, at time 2025-05-14 03:27:11.093985
2025-05-14 03:27:21,637 - INFO - Training rf on fold 3
2025-05-14 03:27:35,951 - INFO - Start training of model rf, at time 2025-05-14 03:27:35.950601
2025-05-14 03:43:50,928 - INFO - End training of model rf, at time 2025-05-14 03:43:50.927223
2025-05-14 03:43:58,954 - INFO - Model: rf, Cross-Validated RMSE: 0.1612603305795914
[I 2025-05-14 03:43:59,018] Trial 11 finished with value: 0.1612603305795914 and parameters: {'xgb_learning_rate': 0.024987228390496174, 'xgb_max_depth': 10, 'xgb_n_estimators': 265, 'xgb_subsample': 0.7145861541801313, 'xgb_colsample_bytree': 0.8139991102724206, 'xgb_gamma': 0.20028201417965252, 'xgb_reg_alpha': 3.5621548121066116e-08, 'xgb_reg_lambda': 0.5648614623242533, 'lgbm_learning_rate': 0.05862445391056891, 'lgbm_num_leaves': 145, 'lgbm_n_estimators': 427, 'lgbm_max_depth': 7, 'lgbm_subsample': 0.7534217889296665, 'lgbm_colsample_bytree': 0.8614454286491282, 'lgbm_reg_alpha': 2.3569064845633837e-06, 'lgbm_reg_lambda': 1.9588569319135115e-05, 'rf_n_estimators': 362, 'rf_max_depth': 17, 'rf_min_samples_split': 18, 'rf_min_samples_leaf': 12, 'rf_max_features': 0.7, 'catboost_iterations': 623, 'catboost_learning_rate': 0.19753754633098403, 'catboost_depth': 4, 'catboost_l2_leaf_reg': 9.872917889086661, 'catboost_border_count': 120}. Best is trial 3 with value: 0.16122992083465745.
2025-05-14 03:43:59,776 - INFO - Training rf on fold 1
2025-05-14 03:44:10,853 - INFO - Start training of model rf, at time 2025-05-14 03:44:10.851648
2025-05-14 04:03:48,065 - INFO - End training of model rf, at time 2025-05-14 04:03:48.064607
2025-05-14 04:03:58,585 - INFO - Training rf on fold 2
2025-05-14 04:04:10,795 - INFO - Start training of model rf, at time 2025-05-14 04:04:10.793283
2025-05-14 04:23:32,536 - INFO - End training of model rf, at time 2025-05-14 04:23:32.534910
2025-05-14 04:23:43,334 - INFO - Training rf on fold 3
2025-05-14 04:23:55,963 - INFO - Start training of model rf, at time 2025-05-14 04:23:55.961056
2025-05-14 04:43:29,144 - INFO - End training of model rf, at time 2025-05-14 04:43:29.142159
2025-05-14 04:43:38,475 - INFO - Model: rf, Cross-Validated RMSE: 0.16125644418633947
[I 2025-05-14 04:43:38,594] Trial 12 finished with value: 0.16125644418633947 and parameters: {'xgb_learning_rate': 0.02473051746254348, 'xgb_max_depth': 7, 'xgb_n_estimators': 325, 'xgb_subsample': 0.7049666614696724, 'xgb_colsample_bytree': 0.8445965454015025, 'xgb_gamma': 0.17139997477894697, 'xgb_reg_alpha': 0.00035548576328417225, 'xgb_reg_lambda': 0.00011466429871870363, 'lgbm_learning_rate': 0.07499106561594987, 'lgbm_num_leaves': 200, 'lgbm_n_estimators': 509, 'lgbm_max_depth': 8, 'lgbm_subsample': 0.7642947463085894, 'lgbm_colsample_bytree': 0.8402176905215427, 'lgbm_reg_alpha': 5.878251722381837e-06, 'lgbm_reg_lambda': 8.383090299034966e-05, 'rf_n_estimators': 406, 'rf_max_depth': 19, 'rf_min_samples_split': 20, 'rf_min_samples_leaf': 13, 'rf_max_features': 0.7, 'catboost_iterations': 747, 'catboost_learning_rate': 0.19631735449032459, 'catboost_depth': 4, 'catboost_l2_leaf_reg': 5.828359468311941, 'catboost_border_count': 100}. Best is trial 3 with value: 0.16122992083465745.
2025-05-14 04:43:39,377 - INFO - Training rf on fold 1
2025-05-14 04:43:54,030 - INFO - Start training of model rf, at time 2025-05-14 04:43:54.029171
2025-05-14 05:10:39,240 - INFO - End training of model rf, at time 2025-05-14 05:10:39.236206
2025-05-14 05:10:58,608 - INFO - Training rf on fold 2
2025-05-14 05:11:11,082 - INFO - Start training of model rf, at time 2025-05-14 05:11:11.080476
2025-05-14 05:37:56,972 - INFO - End training of model rf, at time 2025-05-14 05:37:56.968618
2025-05-14 05:38:17,420 - INFO - Training rf on fold 3
2025-05-14 05:38:31,629 - INFO - Start training of model rf, at time 2025-05-14 05:38:31.628525
2025-05-14 06:05:15,901 - INFO - End training of model rf, at time 2025-05-14 06:05:15.897956
2025-05-14 06:05:36,319 - INFO - Model: rf, Cross-Validated RMSE: 0.16130375108786768
[I 2025-05-14 06:05:36,555] Trial 13 finished with value: 0.16130375108786768 and parameters: {'xgb_learning_rate': 0.01428072596052895, 'xgb_max_depth': 6, 'xgb_n_estimators': 406, 'xgb_subsample': 0.6500572673225241, 'xgb_colsample_bytree': 0.8233155913642022, 'xgb_gamma': 0.13418201233352373, 'xgb_reg_alpha': 0.00107356598367886, 'xgb_reg_lambda': 7.717885752541567e-05, 'lgbm_learning_rate': 0.09692656606766223, 'lgbm_num_leaves': 199, 'lgbm_n_estimators': 541, 'lgbm_max_depth': 9, 'lgbm_subsample': 0.7921714007363498, 'lgbm_colsample_bytree': 0.6788006109243431, 'lgbm_reg_alpha': 1.0072634422983742e-08, 'lgbm_reg_lambda': 0.003315998727643994, 'rf_n_estimators': 493, 'rf_max_depth': 25, 'rf_min_samples_split': 20, 'rf_min_samples_leaf': 14, 'rf_max_features': 0.7, 'catboost_iterations': 741, 'catboost_learning_rate': 0.1256643323400966, 'catboost_depth': 8, 'catboost_l2_leaf_reg': 5.282405205820431, 'catboost_border_count': 48}. Best is trial 3 with value: 0.16122992083465745.
2025-05-14 06:05:37,718 - INFO - Training rf on fold 1
2025-05-14 06:05:48,845 - INFO - Start training of model rf, at time 2025-05-14 06:05:48.845084
Exception ignored in: <function Image.__del__ at 0x7f3b30229b20>
Traceback (most recent call last):
  File "/home/david/fork/DataMining/.conda/lib/python3.12/tkinter/__init__.py", line 4119, in __del__
    self.tk.call('image', 'delete', self.name)
RuntimeError: main thread is not in main loop
Exception ignored in: <function Variable.__del__ at 0x7f3b301ab2e0>
Traceback (most recent call last):
  File "/home/david/fork/DataMining/.conda/lib/python3.12/tkinter/__init__.py", line 414, in __del__
    if self._tk.getboolean(self._tk.call("info", "exists", self._name)):
                           ^^^^^^^^^^^^^^^^^^^^^^^^^^^^^^^^^^^^^^^^^^^
RuntimeError: main thread is not in main loop
Exception ignored in: <function Variable.__del__ at 0x7f3b301ab2e0>
Traceback (most recent call last):
  File "/home/david/fork/DataMining/.conda/lib/python3.12/tkinter/__init__.py", line 414, in __del__
    if self._tk.getboolean(self._tk.call("info", "exists", self._name)):
                           ^^^^^^^^^^^^^^^^^^^^^^^^^^^^^^^^^^^^^^^^^^^
RuntimeError: main thread is not in main loop
Exception ignored in: <function Variable.__del__ at 0x7f3b301ab2e0>
Traceback (most recent call last):
  File "/home/david/fork/DataMining/.conda/lib/python3.12/tkinter/__init__.py", line 414, in __del__
    if self._tk.getboolean(self._tk.call("info", "exists", self._name)):
                           ^^^^^^^^^^^^^^^^^^^^^^^^^^^^^^^^^^^^^^^^^^^
RuntimeError: main thread is not in main loop 